Link, Anchor Text
"https://www.google.com/webhp?hl=en", 
"http://www.reuters.com/article/us-japan-immigration-idUSKCN0XN07X", Japan eyes more foreign workers, stealthily challenging immigration ...
"http://www.reuters.com/article/us-usa-immigration-fingerprints-idUSKCN0XN0BD", Exclusive: US agencies split over fingerprinting parents of child ...
"http://www.nydailynews.com/new-york/citizenship-now/pols-launch-daily-news-citizenship-immigration-hotline-article-1.2614275", Lawmakers, volunteers launch Daily News/Citizenship NOW ...
"http://www.sacbee.com/news/politics-government/capitol-alert/article73928782.html", California U.S. Senate candidates quarrel over illegal immigration
"http://www.breitbart.com/2016-presidential-race/2016/04/26/trump-meets-italys-salvini-total-agreement-immigration/", Trump Meets Italy's Salvini, 'Total Agreement' on Immigration
"http://www.seattletimes.com/opinion/editorials/how-immigration-reform-would-help-unlock-human-potential/", How immigration reform would help unlock human potential
"http://www.scpr.org/news/2016/04/26/59963/supporters-rally-for-valley-immigration-consultant/", Supporters rally for Valley immigration consultants facing city fraud ...
"http://www.cnbc.com/2016/04/25/the-tea-party-has-more-in-common-with-immigration-reform-advocates-than-you-think-commentary.html", The Tea Party has more in common with immigration activists than ...
"http://dailycaller.com/2016/04/26/game-of-thrones-stars-on-european-immigration-crisis-lie-back-and-think-of-westeros/", Game Of Thrones Stars On European Immigration Crisis: Lie Back ...
"http://frontrow.dmagazine.com/2016/04/deferred-action-dallas-play-theater/", Immigration Play Deferred Action Speaks to the Country's DREAMers